{
  "schema_version": "0.1.0",
  "sutra_id": "sutra_012",
  "sutra_version": "1.0.0",
  "compatibility": ["0.1.x"],
  "name": "LLM Creative Generation",
  "type": "llm",
  "category": "generative",
  "pramana": "shabda",
  "inputs": [
    {"name": "prompt", "type": "string", "required": true},
    {"name": "max_tokens", "type": "integer", "required": false},
    {"name": "temperature", "type": "number", "required": false}
  ],
  "outputs": [
    {"name": "generated_text", "type": "string"},
    {"name": "prompt", "type": "string"},
    {"name": "model", "type": "string"}
  ],
  "prerequisites": [],
  "operation": {
    "module": "sutras.llm.llm_generate",
    "entry_point": "execute"
  },
  "validation": {
    "tests": [
      {
        "input": {
          "prompt": "Say hello world",
          "max_tokens": 10,
          "temperature": 0.0
        },
        "expected": {"generated_text": "Hello world"}
      }
    ]
  }
}
