{
  "schema_version": "0.1.0",
  "sutra_id": "sutra_044",
  "sutra_version": "1.0.0",
  "compatibility": ["0.1.x"],
  "name": "District Intelligence",
  "type": "agriculture",
  "category": "domain",
  "pramana": "anumana",
  "inputs": [
    {"name": "district", "type": "string", "required": true}
  ],
  "outputs": [
    {"name": "district", "type": "string"},
    {"name": "soil_type", "type": "string"},
    {"name": "rainfall", "type": "string"},
    {"name": "major_crops", "type": "array"},
    {"name": "recommended_crops", "type": "array"},
    {"name": "advice", "type": "string"}
  ],
  "prerequisites": [],
  "operation": {
    "module": "sutras.agriculture.district_intelligence",
    "entry_point": "execute"
  },
  "validation": {"tests": []}
}
