{
  "schema_version": "0.1.0",
  "sutra_id": "sutra_055",
  "sutra_version": "1.0.0",
  "compatibility": ["0.1.x"],
  "name": "Semantic Retrieval",
  "type": "memory",
  "category": "core",
  "pramana": "anumana",
  "inputs": [
    {"name": "query", "type": "string", "required": true},
    {"name": "top_k", "type": "integer", "required": false}
  ],
  "outputs": [
    {"name": "results", "type": "array"},
    {"name": "count", "type": "integer"}
  ],
  "prerequisites": [],
  "operation": {
    "module": "sutras.memory.semantic_retrieval",
    "entry_point": "execute"
  },
  "validation": {"tests": []}
}
