{
  "schema_version": "0.1.0",
  "sutra_id": "sutra_005",
  "sutra_version": "1.0.0",
  "compatibility": ["0.1.x"],
  "name": "Integer Comparison",
  "type": "logic",
  "category": "core",
  "pramana": "anumana",
  "inputs": [
    {"name": "a", "type": "integer", "required": true},
    {"name": "b", "type": "integer", "required": true},
    {"name": "operator", "type": "string", "required": false}
  ],
  "outputs": [
    {"name": "result", "type": "boolean"}
  ],
  "prerequisites": [],
  "operation": {
    "module": "sutras.logic.compare",
    "entry_point": "execute"
  },
  "validation": {
    "tests": [
      {"input": {"a": 5, "b": 3, "operator": "gt"}, "expected": {"result": true}},
      {"input": {"a": 2, "b": 2, "operator": "eq"}, "expected": {"result": true}}
    ]
  }
}
