{
  "schema_version": "0.1.0",
  "sutra_id": "sutra_072",
  "sutra_version": "1.0.0",
  "compatibility": ["0.1.x"],
  "name": "Response Validator",
  "type": "core",
  "category": "core",
  "pramana": "pratyaksha",
  "inputs": [
    {"name": "response", "type": "string", "required": true},
    {"name": "confidence", "type": "number", "required": false},
    {"name": "sources", "type": "array", "required": false}
  ],
  "outputs": [
    {"name": "validated", "type": "boolean"},
    {"name": "quality", "type": "number"},
    {"name": "approved", "type": "boolean"}
  ],
  "prerequisites": [],
  "operation": {
    "module": "sutras.core.response_validator",
    "entry_point": "execute"
  },
  "validation": {"tests": []}
}
