{
  "schema_version": "0.1.0",
  "sutra_id": "sutra_022",
  "sutra_version": "1.0.0",
  "compatibility": ["0.1.x"],
  "name": "Math Tutor",
  "type": "education",
  "category": "domain",
  "pramana": "pratyaksha",
  "inputs": [
    {"name": "concept", "type": "string", "required": true}
  ],
  "outputs": [
    {"name": "explanation", "type": "string"}
  ],
  "prerequisites": [],
  "operation": {
    "module": "sutras.education.math_tutor",
    "entry_point": "execute"
  },
  "validation": {
    "tests": [
      {
        "input": {"concept": "addition"},
        "expected": {"explanation": "Addition is combining two or more numbers."}
      }
    ]
  }
}
