{
  "schema_version": "0.1.0",
  "sutra_id": "sutra_087",
  "sutra_version": "1.0.0",
  "compatibility": ["0.1.x"],
  "name": "Math Tutor",
  "type": "education",
  "category": "domain",
  "pramana": "pratyaksha",
  "inputs": [
    {"name": "concept", "type": "string", "required": true},
    {"name": "level", "type": "string", "required": false}
  ],
  "outputs": [
    {"name": "explanation", "type": "string"},
    {"name": "next_topic", "type": "string"}
  ],
  "prerequisites": [],
  "operation": {
    "module": "sutras.education.math_tutor",
    "entry_point": "execute"
  },
  "validation": {"tests": []}
}
